{
  "schema": "ucc.transfer",
  "schema_version": 1,
  "id": "xfer_01K0A6R4V8W6E3M4M8Y0R9J2QX",
  "created_at": "2026-08-22T12:00:00.000Z",
  "created_by": "act_01K0A6R4V8W6E3M4M8Y0R9J2QA",
  "record_version": 1,
  "direction": "controller_to_node",
  "node_id": "node_01K0A6R4V8W6E3M4M8Y0R9J2QX",
  "source_path": "staging/payload.tar.gz",
  "destination_path": "payloads/payload.tar.gz",
  "transfer_phase": "validated",
  "size_bytes": 10240,
  "content_hash": "sha256:0123456789abcdef0123456789abcdef0123456789abcdef0123456789abcdef"
}
